{
  "generatedBy": "stub",
  "generatedAt": "2026-07-10T15:51:59.696Z",
  "profile": {
    "count": 82,
    "tags": {},
    "emotions": {
      "calm": 82
    },
    "orient": {
      "portrait": 37,
      "landscape": 45
    },
    "heroCount": 0,
    "topEmotion": "calm"
  },
  "options": [
    {
      "id": "A",
      "title": "Luxury Wedding Film",
      "mood": "elegant, refined, unhurried",
      "pacing": "slow",
      "emotionalArc": "quiet awe that swells to a graceful, glowing finale",
      "summary": "A minimal, cinematic edit that lets the strongest images breathe with sparse, tasteful text.",
      "captionTone": "minimal and poetic",
      "fitReason": "suits sets with several strong hero-worthy frames."
    },
    {
      "id": "B",
      "title": "A Day To Remember",
      "mood": "warm, heartfelt, chronological",
      "pacing": "medium",
      "emotionalArc": "gentle beginning, rising warmth, tearful-happy peak, soft landing",
      "summary": "Tells the day in order, leaning into candid, emotional moments and family warmth.",
      "captionTone": "warm and personal",
      "fitReason": "works when the set spans getting-ready through celebration."
    },
    {
      "id": "C",
      "title": "Korean Romance",
      "mood": "dreamy, soft, bright",
      "pacing": "medium",
      "emotionalArc": "airy and tender throughout, blooming at the couple moments",
      "summary": "A light, romantic mood board of close, tender couple frames with a delicate feel.",
      "captionTone": "gentle and sparse",
      "fitReason": "flatters portrait-heavy, tender couple photography."
    },
    {
      "id": "D",
      "title": "Family & Friends",
      "mood": "joyful, lively, connected",
      "pacing": "dynamic",
      "emotionalArc": "playful energy building to a big, joyful group finale",
      "summary": "Centres the people around the couple — laughter, groups and celebration.",
      "captionTone": "warm and upbeat",
      "fitReason": "shines when there are many group and candid photos."
    }
  ],
  "recommended": "A"
}